question,choices,answer,explanation,category,options
"A network technician is troubleshooting an application that uses TCP. The technician notices that the connection is slow, and the bandwidth is underutilized. What could be the issue?",,Flow control and congestion window are limiting throughput,TCP uses flow control and a congestion window to prevent network congestion. These mechanisms can slow down data transfer if the network is congested or if there are flow control issues.,transport-layer,"['Flow control and congestion window are limiting throughput', 'TCP connection is being dropped and re-established', 'The application is running on an incorrect port', 'The device is using the wrong transport protocol']"
"A network administrator is trying to set up a new service on port 443. After configuring the server, the service is not accessible from external devices. What could be causing this issue?",,The firewall is blocking TCP port 443,"TCP port 443 is typically used for HTTPS traffic. If the firewall is blocking this port, external devices will not be able to access the service running on this port.",transport-layer,"['The firewall is blocking TCP port 443', 'UDP port 443 is not open', 'The router is not routing TCP packets', 'Port 443 is being used by another service']"
You are configuring a new web application that requires secure communication. Which transport layer protocol and port should be used?,,TCP - Port 443,"HTTPS uses TCP on port 443 to provide secure, encrypted communication for web applications.",transport-layer,"['TCP - Port 80', 'TCP - Port 443', 'UDP - Port 80', 'UDP - Port 443']"
A network administrator is configuring a DNS server. What transport layer protocol and port should the server use for queries?,,UDP - Port 53,"DNS queries typically use UDP on port 53, as it is faster and requires less overhead than TCP, which is more suited for reliable connections.",transport-layer,"['UDP - Port 53', 'TCP - Port 53', 'UDP - Port 80', 'TCP - Port 80']"
"A user is experiencing issues with their email client, and the technician notices that port 25 is being used. What protocol is most likely being used for sending email?",,SMTP,SMTP (Simple Mail Transfer Protocol) uses port 25 to send email. Port 25 is used for communication between email servers.,transport-layer,"['SMTP', 'IMAP', 'POP3', 'FTP']"
You are tasked with configuring a network application that requires both reliability and low latency. Which transport layer protocol should you choose?,,TCP,"TCP provides reliability by ensuring that data is delivered correctly, though it introduces some latency due to its error-checking mechanisms. It is the best choice when reliability is crucial.",transport-layer,"['TCP', 'UDP', 'ICMP', 'FTP']"
"During a network troubleshooting session, you find that a web application is not receiving data properly. The application is running on TCP port 80. What should you check first?",,Firewall blocking port 80,"If the application is running on port 80, ensure that no firewall is blocking incoming traffic on this port, as it is used by HTTP for web traffic.",transport-layer,"['Firewall blocking port 80', 'Application server misconfiguration', 'DNS resolution issue', 'Incorrect IP addressing']"
"A customer reports that their FTP server is experiencing slow data transfers, even though the connection is established. What could be causing the slow transfer speeds?",,TCP window size is too small,A small TCP window size can limit the throughput of data transfers. Increasing the window size can improve the data transfer speed in TCP.,transport-layer,"['TCP window size is too small', 'The FTP server is using UDP', 'The server is behind a NAT device', 'The client is using the wrong FTP port']"
You are troubleshooting a network where two devices are communicating over a TCP connection. You notice frequent retransmissions of packets. What is the likely cause?,,Network congestion or packet loss,"Frequent retransmissions in TCP can occur due to network congestion or packet loss, requiring the sender to resend lost data to ensure reliable delivery.",transport-layer,"['Network congestion or packet loss', 'The devices are using UDP incorrectly', 'The connection is being throttled by the firewall', 'The devices are not synchronizing correctly']"
"A client is having trouble establishing a TCP connection to a server. You observe that the client is sending a SYN message, but the server is not responding. What could be the issue?",,The server's firewall is blocking incoming SYN packets,"If the server does not respond to a SYN packet during the TCP handshake, it is likely that a firewall or security device is blocking incoming connections.",transport-layer,"[""The server's firewall is blocking incoming SYN packets"", ""The server's TCP buffer is full"", 'The client is using the wrong port', 'The client is sending a malformed SYN packet']"
"During a TCP connection, you notice that the data is being sent without any acknowledgment. What could be the reason for this?",,The ACK flag is not set in the TCP header,"TCP requires the ACK flag to be set in the header to acknowledge the receipt of data. If acknowledgments are not sent, it could indicate an issue with the flag or configuration.",transport-layer,"['The ACK flag is not set in the TCP header', 'The TCP window size is too large', 'The source port is incorrect', 'The firewall is blocking the ACK packets']"
"You are configuring an application that needs to send real-time updates, but you cannot afford to retransmit lost data. Which transport protocol is most appropriate?",,UDP,"UDP is a connectionless protocol that does not retransmit lost data, making it ideal for applications like video or voice streaming where low latency is more important than reliable delivery.",transport-layer,"['TCP', 'UDP', 'ICMP', 'IGMP']"
A client is unable to connect to a web server via HTTPS. You verify that the client is attempting to connect to port 443. What might be the cause of the issue?,,Port 443 is blocked by the firewall,"Port 443 is used for HTTPS, and if it is blocked by a firewall, the client will not be able to establish a secure connection to the web server.",transport-layer,"['The web server is not configured to use TCP', 'Port 443 is blocked by the firewall', 'The client is using an incorrect protocol', 'The client’s browser is not SSL/TLS-capable']"
"During troubleshooting, you find that a TCP connection is being terminated unexpectedly. What might be the cause?",,The FIN flag was sent prematurely,"The FIN flag is used to signal the termination of a TCP connection. If it is sent prematurely, it can cause the connection to terminate unexpectedly.",transport-layer,"['The FIN flag was sent prematurely', 'The sequence numbers are mismatched', 'The TCP window size is too small', 'The port is being used by another application']"
"A client is communicating with a web server, and during the TCP handshake, they receive a SYN-ACK packet, but no further packets are exchanged. What could be the problem?",,The client is not sending the ACK packet,"During the TCP handshake, the client must send an ACK packet after receiving the SYN-ACK to establish the connection. If the ACK is not sent, the handshake cannot complete.",transport-layer,"['The client is not sending the ACK packet', 'The server is not properly handling the SYN-ACK', 'The connection is being reset by the firewall', ""The server's maximum TCP connection limit is reached""]"
"You notice that your application, which uses UDP, is receiving error messages related to checksum failures. What could be the cause of the issue?",,Corruption of packets during transmission,"UDP includes a checksum field to detect errors in transmission. If the packets are corrupted, the checksum will fail, causing the error message.",transport-layer,"['Corruption of packets during transmission', 'Incorrect port number in the UDP header', 'UDP packets are being fragmented', 'The application is using the wrong transport protocol']"
You are tasked with improving the throughput of a TCP-based application. Which of the following should you adjust to help with this?,,Increase the TCP window size,"Increasing the TCP window size allows more data to be sent before an acknowledgment is required, improving throughput by utilizing available bandwidth more efficiently.",transport-layer,"['Increase the TCP window size', 'Decrease the TCP window size', 'Enable UDP', 'Increase the TTL value']"
"A network administrator is attempting to test a new TCP service, but the client cannot connect to the server. What should the administrator check first?",,Firewall rules blocking the TCP port,"If a client cannot connect to a server, the first thing to check is whether the firewall is blocking the port used by the service.",transport-layer,"['Firewall rules blocking the TCP port', 'Incorrect IP addressing', 'Incorrect transport protocol', 'Network cable connectivity']"
You are analyzing a network trace and notice that packets sent from your server are being dropped due to an oversized segment. What should you check?,,MTU size configuration,"If packets are being dropped due to an oversized segment, it could indicate an issue with the Maximum Transmission Unit (MTU) size, which needs to be adjusted to fit the network path's capacity.",transport-layer,"['MTU size configuration', 'Firewall filtering', 'Transport protocol being used', 'Port numbers in the packets']"
A network technician is troubleshooting a connection issue and notices that no SYN-ACK packet is being received. What is the most likely cause?,,The server's firewall is blocking the SYN packet,"If no SYN-ACK is received after sending a SYN, it is likely that a firewall on the server is blocking incoming TCP connection requests.",transport-layer,"[""The server's firewall is blocking the SYN packet"", 'The client has sent an invalid SYN packet', 'The connection is using UDP instead of TCP', 'The TCP connection was established incorrectly']"
A user is unable to connect to a secure website via HTTPS. The client device is attempting to connect on port 443. What is the first step to troubleshoot the issue?,,Check if the firewall is blocking TCP port 443,"Port 443 is used for HTTPS. If there is an issue with connecting, the first step should be to check if a firewall is blocking this port.",transport-layer,"['Check if the firewall is blocking TCP port 443', 'Verify the SSL certificate on the web server', 'Check the DNS configuration', 'Ensure the server is running on the correct IP address']"
You are configuring a video conferencing application. Which transport layer protocol would be most suitable for this type of application?,,UDP,UDP is ideal for real-time applications such as video conferencing because it has low latency and does not wait for acknowledgments or retransmit lost packets.,transport-layer,"['TCP', 'UDP', 'ICMP', 'FTP']"
A server is receiving sporadic data loss from clients. Which transport layer feature should you investigate to prevent this data loss?,,Congestion control and flow control in TCP,TCP’s congestion control and flow control mechanisms help avoid data loss by adjusting the transmission rate based on network conditions.,transport-layer,"['Congestion control and flow control in TCP', 'UDP packet size configuration', 'Firewall rules filtering UDP traffic', 'TCP window size']"
A technician is working on a network and notices that UDP traffic is not being received on port 161. What is most likely causing this?,,A firewall is blocking UDP port 161,"UDP port 161 is used by the SNMP (Simple Network Management Protocol). If UDP traffic is not being received, it's often due to firewall rules blocking this port.",transport-layer,"['The UDP protocol is not configured correctly', 'The SNMP service is down on the server', 'A firewall is blocking UDP port 161', 'There is a DNS issue']"
You are troubleshooting a TCP connection issue and notice that the application is unable to receive data. What could be causing this issue?,,TCP window size is too small,"A small TCP window size limits the amount of data that can be in-flight before an acknowledgment is received, causing throughput issues.",transport-layer,"['TCP window size is too small', 'UDP is being used incorrectly', 'The server is using port 443', 'There is a DNS resolution issue']"
"During the establishment of a TCP connection, you observe that the client repeatedly sends SYN packets but never receives SYN-ACK responses. What could be causing this?",,Firewall blocking the SYN-ACK responses,"A common cause of this issue is a firewall or filtering device blocking the SYN-ACK response from the server, preventing the three-way handshake from completing.",transport-layer,"['Firewall blocking the SYN-ACK responses', 'The client is using an invalid port', 'The server is not accepting TCP connections', 'The TCP connection is being reset']"
"You are troubleshooting a VoIP application. The call quality is poor and choppy, with noticeable latency. Which transport protocol would improve performance for this application?",,UDP,"UDP is suitable for real-time applications like VoIP because it minimizes latency by not retransmitting lost packets, even though this can result in some data loss.",transport-layer,"['TCP', 'UDP', 'ICMP', 'FTP']"
"A web server is receiving a large number of TCP SYN packets, but no data is being transmitted. What is the likely issue?",,The server is under a SYN flood attack,"A SYN flood attack involves sending a large number of SYN packets to exhaust server resources, preventing legitimate connections from being established.",transport-layer,"['The server is under a SYN flood attack', 'The server is misconfigured', 'The firewall is blocking incoming traffic', ""The server's TCP connection limit has been reached""]"
You are configuring a new firewall rule to allow inbound connections for FTP. Which port should be allowed for this service?,,TCP 20 and 21,"FTP uses TCP ports 20 and 21 for control and data connections. Port 21 is used for control, while port 20 is used for data transfer in active mode.",transport-layer,"['TCP 20 and 21', 'TCP 80', 'UDP 161', 'TCP 443']"
"During a packet capture, you observe that some packets are being dropped due to exceeding the Maximum Transmission Unit (MTU). What should you adjust?",,Decrease the MTU size on the sending device,"When packets exceed the MTU size, they are fragmented or dropped. Adjusting the MTU size on the sending device can help avoid these issues.",transport-layer,"['Increase the MTU size on the network interface', 'Decrease the MTU size on the sending device', 'Enable flow control on the devices', 'Switch from TCP to UDP']"
A network administrator is troubleshooting a TCP session that repeatedly resets. What should the administrator check first?,,TCP flags (RST flag),"The RST flag in a TCP packet is used to reset a connection. If sessions are being reset, it is crucial to check for the presence of RST flags in the packets.",transport-layer,"['TCP flags (RST flag)', 'Firewall logs', 'TCP window size', 'Port blocking']"
"A server is responding to HTTP requests, but the response times are slow. Which TCP feature could be affecting the performance?",,Congestion window,The congestion window controls the flow of data during a TCP session. A small congestion window can limit throughput and cause slow response times.,transport-layer,"['Congestion window', 'Checksum field', 'Sequence numbers', 'Maximum segment size']"
"A VoIP system is experiencing jitter, causing uneven audio quality during calls. Which transport layer protocol should be considered to reduce jitter?",,UDP,UDP is preferred for real-time applications like VoIP because it minimizes jitter by not waiting for lost packets to be retransmitted.,transport-layer,"['TCP', 'UDP', 'ICMP', 'IGMP']"
"During a TCP connection, you notice that the connection terminates unexpectedly. What might be the cause?",,The FIN flag was sent prematurely,"The FIN flag signals the end of a TCP connection. If it is sent prematurely, the connection can be terminated unexpectedly.",transport-layer,"['The FIN flag was sent prematurely', 'The sequence numbers were mismatched', 'The server is overloaded', 'The client sent an RST packet']"
A web application is being tested for reliability and performance. The connection occasionally drops and packets are retransmitted. What is most likely the cause?,,Network congestion or packet loss,"TCP retransmits packets when they are lost, which is commonly caused by network congestion or intermittent packet loss.",transport-layer,"['Network congestion or packet loss', 'Incorrect application configuration', 'Firewall blocking TCP packets', 'Port mismatch on the server']"
"During a packet analysis, you notice that a connection is using the TCP three-way handshake. Which flags are involved in this process?",,"SYN, SYN-ACK, ACK","The TCP three-way handshake involves three steps: the client sends a SYN, the server responds with SYN-ACK, and the client sends an ACK to complete the connection.",transport-layer,"['SYN, SYN-ACK, ACK', 'SYN, FIN, ACK', 'ACK, PSH, RST', 'RST, FIN, SYN']"
A user is unable to connect to a mail server over IMAP. You find that the server is using port 143. What should you check next?,,Firewall blocking port 143,"IMAP typically uses port 143. If a user cannot connect, the first thing to check is whether a firewall is blocking this port.",transport-layer,"['Firewall blocking port 143', 'Server misconfiguration', 'DNS resolution issue', 'Incorrect IP addressing']"
A network administrator is configuring a file transfer system. The system is designed to ensure that lost packets are retransmitted. Which transport protocol should be used?,,TCP,"TCP is the transport protocol that guarantees reliable data delivery, including retransmission of lost packets.",transport-layer,"['TCP', 'UDP', 'ICMP', 'FTP']"
You are troubleshooting a network where a client is experiencing poor performance while streaming video. Which transport protocol could be causing the issue?,,TCP,"TCP's reliability mechanisms, such as acknowledgments and retransmissions, can introduce latency. For video streaming, UDP is preferred to avoid delays.",transport-layer,"['TCP', 'UDP', 'ICMP', 'FTP']"
A network administrator is configuring a firewall and needs to allow incoming HTTPS traffic. Which port should be opened on the firewall?,,TCP port 443,HTTPS traffic uses TCP port 443 to provide secure communication over the web. Port 80 is used for HTTP traffic.,transport-layer,"['TCP port 80', 'TCP port 443', 'UDP port 443', 'UDP port 80']"
"A user cannot access a web server using HTTPS. You verify that port 443 is open, but the problem persists. What is the next step in troubleshooting?",,Check the SSL/TLS certificate on the server,"If port 443 is open but HTTPS is not working, the issue could be with the server's SSL/TLS certificate, which is essential for secure communication.",transport-layer,"['Check the SSL/TLS certificate on the server', 'Ensure the server is using TCP', 'Verify the DNS server configuration', 'Check the routing configuration']"
A network administrator is troubleshooting a server and notices that TCP connections are not being established. What could be the issue?,,The server is behind a firewall blocking SYN packets,"If the server is behind a firewall blocking SYN packets, the three-way handshake cannot be completed, preventing TCP connections from being established.",transport-layer,"['The server is behind a firewall blocking SYN packets', 'The TCP window size is too large', 'The server is using the wrong transport protocol', 'The port is already in use by another application']"
Which of the following devices operates primarily at the Data Link Layer to filter traffic based on MAC addresses?,,Switch,"A switch operates primarily at the Data Link Layer, filtering traffic based on MAC addresses. It creates a MAC address table to forward frames to the correct destination port.",datalink-layer,"['Router', 'Switch', 'Hub', 'Bridge']"
What does the Data Link Layer use to ensure that data is delivered to the correct device on a local network?,,MAC address,The Data Link Layer uses MAC addresses to uniquely identify devices on the same local network and ensure that data is delivered to the correct device.,datalink-layer,"['IP address', 'MAC address', 'Port number', 'Subnet mask']"
"In a scenario where a network device is sending data to another device within the same broadcast domain, which address is used for the delivery of frames?",,MAC address,"In a local network within the same broadcast domain, data frames are delivered based on the destination MAC address, which is unique to each device on the network.",datalink-layer,"['IP address', 'MAC address', 'Port number', 'DNS address']"
Which of the following protocols operates at the Data Link Layer and provides error detection and correction for transmitted data?,,Ethernet,Ethernet provides error detection and correction at the Data Link Layer using a Frame Check Sequence (FCS) field to verify the integrity of transmitted frames.,datalink-layer,"['TCP', 'IP', 'Ethernet', 'ARP']"
A network engineer is troubleshooting a connectivity issue on a local area network (LAN). Which tool can they use to inspect and analyze traffic at the Data Link Layer?,,Wireshark,"Wireshark is a network protocol analyzer that can capture and analyze network traffic at various layers, including the Data Link Layer, to troubleshoot connectivity issues.",datalink-layer,"['Ping', 'Traceroute', 'Wireshark', 'Telnet']"
Which of the following is true about the Data Link Layer in the OSI model?,,It provides error detection and correction for physical transmission.,The Data Link Layer provides error detection and correction for frames transmitted over the physical medium. It ensures reliable data transfer within a local network.,datalink-layer,"['It is responsible for routing packets across different networks.', 'It provides error detection and correction for physical transmission.', 'It defines the rules for data compression.', 'It handles the conversion of digital signals into analog.']"
Which Ethernet frame type is used to prevent collision on a network with multiple devices sharing the same communication medium?,,Broadcast,"A broadcast frame is sent to all devices on a local network segment, and it is used to avoid collisions by ensuring that devices are aware of the communication happening on the network.",datalink-layer,"['Broadcast', 'Unicast', 'Multicast', 'Collision domain']"
"In a switched Ethernet network, which mechanism is used to determine where to send frames based on the destination MAC address?",,MAC Address Table,"In switched Ethernet networks, the switch uses a MAC address table to map each device's MAC address to a specific port, allowing it to forward frames to the correct destination.",datalink-layer,"['Routing Table', 'ARP Table', 'MAC Address Table', 'ARP Cache']"
Which type of Ethernet frame is used to communicate with all devices on a network segment?,,Broadcast,"A broadcast Ethernet frame is sent to all devices within a network segment. The destination MAC address is set to FF:FF:FF:FF:FF:FF, which all devices recognize.",datalink-layer,"['Unicast', 'Multicast', 'Broadcast', 'Point-to-point']"
What is the purpose of the Frame Check Sequence (FCS) field in an Ethernet frame?,,To provide error detection for the transmitted data,The FCS field in an Ethernet frame contains a cyclic redundancy check (CRC) value that is used to verify the integrity of the transmitted data and detect errors.,datalink-layer,"[""To indicate the destination device's MAC address"", 'To provide error detection for the transmitted data', 'To identify the type of data being transmitted', 'To store the payload data']"
Which type of Ethernet frame is used when sending data from one device to another on a local area network (LAN)?,,Unicast,"A unicast Ethernet frame is used to send data from one device to a specific device on the network, identified by its unique MAC address.",datalink-layer,"['Unicast', 'Multicast', 'Broadcast', 'Anycast']"
Which device is primarily responsible for controlling access to the shared medium in an Ethernet network using the CSMA/CD protocol?,,NIC,"The network interface card (NIC) on a device is responsible for implementing the CSMA/CD protocol, which controls access to the shared Ethernet medium to prevent collisions.",datalink-layer,"['Router', 'Hub', 'Switch', 'NIC']"
Which of the following is a primary responsibility of the Data Link Layer in relation to the Physical Layer?,,Framing and error detection,The Data Link Layer is responsible for framing data into manageable chunks and performing error detection to ensure that data is transmitted accurately over the physical medium.,datalink-layer,"['Providing logical addressing', 'Routing packets between networks', 'Establishing, maintaining, and terminating sessions', 'Framing and error detection']"
Which Data Link Layer protocol is used to obtain the MAC address of a device from an IP address on an Ethernet network?,,ARP,"The Address Resolution Protocol (ARP) is used to map an IP address to its corresponding MAC address, allowing devices to communicate with each other on a local network.",datalink-layer,"['ARP', 'IP', 'RARP', 'PPP']"
"In a network with multiple devices, which of the following will prevent data collisions from occurring?",,Switching,"Switching prevents data collisions by segmenting the network into smaller collision domains, ensuring that devices connected to different switch ports do not interfere with each other.",datalink-layer,"['Switching', 'Ethernet', 'Hubbing', 'Routing']"
