question,choices,answer,explanation,category,options
How many /30 subnets can be created from a /24 network?,"['32', '64', '128', '256']",64,A /30 subnet has 4 addresses (2 usable). A /24 network has 256 addresses. 256/4 = 64 subnets.,subnetting,
What is the last valid host address in the 192.168.10.32/29 subnet?,"['192.168.10.38', '192.168.10.39', '192.168.10.40', '192.168.10.41']",192.168.10.38,"A /29 subnet has 8 total addresses, 6 usable. The range is 192.168.10.32 - 192.168.10.39, making 38 the last valid host.",subnetting,
How many /29 subnets fit into a /26 subnet?,"['2', '4', '8', '16']",4,A /26 has 64 addresses. A /29 has 8. 64/8 = 4.,subnetting,
What subnet mask allows for exactly 1022 usable hosts?,"['/22', '/23', '/24', '/25']",/22,"A /22 subnet has 1024 total addresses, with 1022 usable hosts.",subnetting,
What is the network address of 10.200.15.67/23?,"['10.200.15.0', '10.200.14.0', '10.200.15.64', '10.200.15.128']",10.200.14.0,A /23 subnet groups addresses in blocks of 512. The address 10.200.15.67 falls into 10.200.14.0 - 10.200.15.255.,subnetting,
A /18 subnet has how many total IP addresses?,"['16,384', '8,192', '4,096', '2,048']","16,384","A /18 subnet has 2^(32-18) = 16,384 total addresses.",subnetting,
What is the first valid host in the 172.16.160.0/20 subnet?,"['172.16.160.1', '172.16.160.2', '172.16.160.10', '172.16.160.255']",172.16.160.1,"A /20 subnet range includes 172.16.160.0 - 172.16.175.255, making the first valid host 172.16.160.1.",subnetting,
How many total subnets does a /30 subnet provide in a /16 network?,"['512', '1024', '2048', '4096']",16384,"A /16 network has 65,536 addresses. A /30 subnet has 4. 65,536/4 = 16,384 subnets.",subnetting,
"If you subnet a /19 network into /24 subnets, how many subnets do you get?","['16', '32', '64', '128']",32,"A /19 network has 8,192 addresses. A /24 has 256. 8192/256 = 32 subnets.",subnetting,
A company needs 1200 subnets from a /16. What subnet mask should be used?,"['/22', '/23', '/24', '/25']",/26,"A /26 subnet provides 1024 total subnets (2^(26-16)), the closest match for 1200.",subnetting,
How many /27 subnets can be created from a /21 network?,"['16', '32', '64', '128']",64,A /21 has 2048 addresses. A /27 has 32. 2048/32 = 64 subnets.,subnetting,
A /28 subnet has how many usable hosts?,"['6', '14', '30', '62']",14,"A /28 subnet has 16 total addresses, with 14 usable hosts.",subnetting,
What is the purpose of subnetting?,"['A) To increase the size of a network', 'B) To improve network security', 'C) To divide a large network into smaller subnets', 'D) To combine multiple networks into one']",C,"Subnetting divides a large network into smaller, more manageable subnets to improve network performance and organization.",Subnetting,
What is the subnet mask for a Class C network?,"['A) 255.255.0.0', 'B) 255.255.255.0', 'C) 255.255.255.255', 'D) 255.0.0.0']",B,"For a Class C network, the subnet mask is 255.255.255.0, which allows for 256 IP addresses in the subnet.",Subnetting,
How many valid host IP addresses are available in a subnet with a subnet mask of 255.255.255.192?,"['A) 30', 'B) 62', 'C) 64', 'D) 126']",A,"The subnet mask 255.255.255.192 has 6 host bits, giving 2^6 - 2 = 30 valid host IP addresses.",Subnetting,
What is the range of IP addresses for the subnet 192.168.1.0/24?,"['A) 192.168.0.1 to 192.168.1.254', 'B) 192.168.1.0 to 192.168.1.255', 'C) 192.168.1.1 to 192.168.1.254', 'D) 192.168.0.0 to 192.168.1.255']",C,"With a /24 subnet mask, the range of valid IP addresses is from 192.168.1.1 to 192.168.1.254.",Subnetting,
What is the first valid host address in the subnet 10.0.0.0/25?,"['A) 10.0.0.1', 'B) 10.0.0.0', 'C) 10.0.0.128', 'D) 10.0.0.127']",A,"In the subnet 10.0.0.0/25, the first valid host address is 10.0.0.1.",Subnetting,
Which subnet mask is represented by the CIDR notation /22?,"['A) 255.255.255.252', 'B) 255.255.255.0', 'C) 255.255.252.0', 'D) 255.255.255.224']",C,A /22 subnet mask corresponds to 255.255.252.0.,Subnetting,
What is the network address for the IP address 192.168.10.45 with a subnet mask of 255.255.255.192?,"['A) 192.168.10.0', 'B) 192.168.10.64', 'C) 192.168.10.32', 'D) 192.168.10.128']",C,"The network address is 192.168.10.32, as it is the first address in the subnet for the given subnet mask.",Subnetting,
How many subnets can be created from a Class C network using a subnet mask of 255.255.255.240?,"['A) 8', 'B) 16', 'C) 14', 'D) 30']",B,"A subnet mask of 255.255.255.240 creates 16 subnets, with 14 usable subnets after accounting for network and broadcast addresses.",Subnetting,
What is the last valid host address in the subnet 192.168.1.0/26?,"['A) 192.168.1.62', 'B) 192.168.1.63', 'C) 192.168.1.64', 'D) 192.168.1.61']",A,"In a /26 subnet, the last valid host address is 192.168.1.62, just before the broadcast address 192.168.1.63.",Subnetting,
Which of the following IP addresses is a private IP address?,"['A) 172.16.50.1', 'B) 192.168.255.255', 'C) 10.0.0.256', 'D) 209.165.200.1']",A,172.16.50.1 is a private IP address as it is within the private IP range 172.16.0.0 - 172.31.255.255.,Subnetting,
Which of the following IP address ranges is used for public IP addresses?,"['A) 10.0.0.0 - 10.255.255.255', 'B) 172.16.0.0 - 172.31.255.255', 'C) 192.168.0.0 - 192.168.255.255', 'D) 203.0.113.0 - 203.0.113.255']",D,203.0.113.0 - 203.0.113.255 is a public IP address range.,Subnetting,
What is the subnet mask for a /27 network?,"['A) 255.255.255.192', 'B) 255.255.255.224', 'C) 255.255.255.240', 'D) 255.255.255.248']",B,A /27 subnet mask corresponds to 255.255.255.224.,Subnetting,
How many total IP addresses are available in the 10.0.0.0/24 network?,"['A) 256', 'B) 254', 'C) 512', 'D) 128']",A,"A /24 subnet mask provides 256 IP addresses, including the network and broadcast addresses.",Subnetting,
What is the broadcast address for the subnet 192.168.100.0/25?,"['A) 192.168.100.127', 'B) 192.168.100.255', 'C) 192.168.100.128', 'D) 192.168.100.63']",A,"With a /25 subnet mask, the broadcast address is 192.168.100.127.",Subnetting,
What is the subnet mask for a /28 network?,"['A) 255.255.255.240', 'B) 255.255.255.252', 'C) 255.255.255.224', 'D) 255.255.255.248']",A,A /28 subnet mask corresponds to 255.255.255.240.,Subnetting,
Which of the following will allow for the most IP addresses?,"['A) 255.255.255.0', 'B) 255.255.255.128', 'C) 255.255.255.192', 'D) 255.255.255.240']",A,A subnet mask of 255.255.255.0 (or /24) provides the most available IP addresses for hosts.,Subnetting,
What is the primary purpose of a VLAN?,,A,VLANs are used to segment network traffic into different logical networks to improve security and performance.,vlan,"['A. To segment network traffic for security and performance improvements', 'B. To combine multiple physical networks into one logical network', 'C. To provide a backup for network infrastructure', 'D. To create redundant network paths']"
Which protocol is used to carry VLAN information across switches?,,B,VTP is a Cisco proprietary protocol used to manage VLAN configuration across a network of Cisco switches.,vlan,"['A. STP', 'B. VLAN Trunking Protocol (VTP)', 'C. DHCP', 'D. ARP']"
Which of the following is a key benefit of using VLANs?,,A,"VLANs improve network performance by segmenting broadcast domains, reducing broadcast traffic.",vlan,"['A. Increased network performance through segmentation', 'B. Increased cable lengths', 'C. Elimination of the need for IP addressing', 'D. Simplified routing across different networks']"
Which type of VLAN configuration allows a single physical switch port to carry traffic for multiple VLANs?,,B,"A trunk port can carry multiple VLANs by tagging each frame with a VLAN ID, allowing for the use of a single physical connection for multiple VLANs.",vlan,"['A. Access VLAN', 'B. Trunk VLAN', 'C. Management VLAN', 'D. Native VLAN']"
What is the default VLAN on most switches?,,A,VLAN 1 is the default VLAN on many switches and is typically used for management purposes.,vlan,"['A. VLAN 1', 'B. VLAN 10', 'C. VLAN 99', 'D. VLAN 100']"
"Which type of VLAN is used for network management purposes, such as monitoring devices?",,C,"A Management VLAN is typically used for devices that manage the network, such as switches, routers, and monitoring tools.",vlan,"['A. Voice VLAN', 'B. Data VLAN', 'C. Management VLAN', 'D. Default VLAN']"
What is the purpose of a VLAN tag in a frame?,,B,"A VLAN tag is added to Ethernet frames to indicate which VLAN the frame belongs to, allowing it to be forwarded properly across a trunk link.",vlan,"['A. To mark the priority of the frame', 'B. To identify the VLAN the frame belongs to', 'C. To provide a routing path for the frame', 'D. To encrypt the frame data']"
What is the role of the native VLAN in trunking?,,B,The native VLAN is used for untagged traffic on a trunk link. Frames that are not tagged with a VLAN ID are assumed to belong to the native VLAN.,vlan,"['A. It is used to tag frames on the trunk link', 'B. It is used for untagged traffic on a trunk link', 'C. It is used for voice traffic on a trunk link', 'D. It is used for data traffic on a trunk link']"
What is a common use case for implementing VLANs?,,B,"VLANs are commonly used to create virtual subnets within a network, improving traffic management and segmentation.",vlan,"['A. To reduce the number of physical switches required', 'B. To create virtual subnets within a network for better traffic control', 'C. To assign IP addresses to all devices automatically', 'D. To secure data from external attacks']"
What is the maximum number of VLANs supported by 802.1Q?,,C,"The IEEE 802.1Q standard supports a maximum of 4096 VLANs, with VLAN IDs ranging from 1 to 4095.",vlan,"['A. 256', 'B. 1024', 'C. 4096', 'D. 8192']"
Which of the following is an advantage of using VLANs in a network?,,A,VLANs reduce broadcast traffic by limiting the scope of broadcasts to devices within the same VLAN.,vlan,"['A. Reduces broadcast traffic by limiting the scope of broadcasts', 'B. Increases the complexity of the network', 'C. Prevents unauthorized access to the network', 'D. Eliminates the need for switches']"
What is the role of a VLAN membership in a switch?,,A,"VLAN membership determines which switch ports belong to a specific VLAN, helping to define broadcast domains.",vlan,"['A. To define which switch ports belong to which VLAN', 'B. To manage the IP addresses for devices on the VLAN', 'C. To define which VLANs can communicate with each other', 'D. To assign a switch port as either trunk or access']"
"In a network with multiple VLANs, which device is responsible for inter-VLAN routing?",,B,"A router is responsible for inter-VLAN routing, allowing devices on different VLANs to communicate with each other.",vlan,"['A. Switch', 'B. Router', 'C. Hub', 'D. Firewall']"
Which of the following commands can be used to configure a VLAN on a Cisco switch?,,B,The 'vlan database' command is used on Cisco switches to define and configure VLANs.,vlan,"['A. ip address vlan 10', 'B. vlan database', 'C. switchport vlan', 'D. vlan create 10']"
What is a VLAN trunking protocol (VTP) used for?,,A,"VTP allows network administrators to configure VLANs on one switch, and then automatically propagate the changes to other switches in the network.",vlan,"['A. To automatically configure VLANs on all switches in a network', 'B. To limit the number of VLANs on a switch', 'C. To secure VLAN traffic from unauthorized access', 'D. To assign VLANs to network devices']"
Which VLAN is typically used for Voice over IP (VoIP) devices?,,C,VLAN 30 is commonly used for Voice over IP (VoIP) devices to separate voice traffic from data traffic.,vlan,"['A. VLAN 10', 'B. VLAN 20', 'C. VLAN 30', 'D. VLAN 99']"
What is the purpose of a 802.1Q tag in a trunking VLAN?,,A,The 802.1Q tag is used to identify the VLAN to which a frame belongs when traveling across a trunk link.,vlan,"['A. To identify the VLAN to which a frame belongs', 'B. To encrypt the frame data', 'C. To prioritize the frame for bandwidth', 'D. To modify the source IP address']"
Which VLAN type is used to support a specific service such as voice or video?,,B,A Voice VLAN is used specifically for Voice over IP (VoIP) traffic to provide better quality and prioritize voice services.,vlan,"['A. Data VLAN', 'B. Voice VLAN', 'C. Management VLAN', 'D. Default VLAN']"
Which command is used to display VLAN information on a Cisco switch?,,A,"The 'show vlan brief' command is used on Cisco switches to display information about VLANs, including VLAN IDs and names.",vlan,"['A. show vlan brief', 'B. show ip vlan', 'C. display vlan information', 'D. show interfaces vlan']"
Which VLAN configuration is used to connect two different switches and allow them to communicate multiple VLANs?,,B,A trunk port allows multiple VLANs to be carried between switches by tagging the traffic with VLAN IDs.,vlan,"['A. Access port', 'B. Trunk port', 'C. Bridge port', 'D. Management port']"
What is the default VLAN used by Cisco switches?,,B,"VLAN 1 is the default VLAN on Cisco switches, used for management and control purposes.",vlan,"['A. VLAN 10', 'B. VLAN 1', 'C. VLAN 99', 'D. VLAN 100']"
Which of the following is an example of a Layer 3 device used for VLAN routing?,,A,"A router is a Layer 3 device used for routing between different VLANs, enabling inter-VLAN communication.",vlan,"['A. Router', 'B. Hub', 'C. Switch', 'D. Bridge']"
What type of VLAN is used to manage the network infrastructure devices?,,B,A Management VLAN is used for managing network infrastructure devices like switches and routers.,vlan,"['A. Data VLAN', 'B. Management VLAN', 'C. Native VLAN', 'D. Voice VLAN']"
Which of the following is the primary advantage of using VLANs in large networks?,,B,"VLANs reduce broadcast domains, helping to optimize network performance and manage traffic more effectively.",vlan,"['A. Simplifies network configuration', 'B. Reduces broadcast domains', 'C. Increases the speed of network connections', 'D. Eliminates the need for routers']"
Which of the following devices can be used to connect multiple VLANs?,,B,A router or Layer 3 switch is required to connect multiple VLANs and route traffic between them.,vlan,"['A. Switch', 'B. Router', 'C. Hub', 'D. Repeater']"
Which VLAN ID range is reserved for private use?,,B,VLAN IDs in the range 1006–4095 are reserved for private use and not typically assigned to default VLANs.,vlan,"['A. 1–1005', 'B. 1006–4095', 'C. 4096–8192', 'D. 2000–3000']"
What is the role of the native VLAN in a trunking link?,,C,"The native VLAN on a trunk link handles untagged frames, which are frames that are not tagged with a VLAN ID.",vlan,"['A. To ensure encryption of all trunked traffic', 'B. To assign a priority to trunked frames', 'C. To handle untagged frames on a trunk link', 'D. To carry voice traffic']"
How can you prevent VLAN hopping attacks?,,A,"Disabling unused ports on switches is one method to prevent VLAN hopping attacks, as it reduces opportunities for unauthorized devices to access the network.",vlan,"['A. By disabling unused ports on switches', 'B. By using static IP addressing', 'C. By enabling DHCP snooping', 'D. By using trunk port isolation']"
In which type of network design are VLANs typically used?,,D,"VLANs are commonly used in hierarchical network topologies, where the network is structured with multiple layers of distribution and access switches.",vlan,"['A. Star topology', 'B. Mesh topology', 'C. Hybrid topology', 'D. Hierarchical topology']"
What is the function of a VLAN Trunking Protocol (VTP) server?,,A,A VTP server manages VLAN configuration and propagates it to other switches in the network to ensure consistent VLAN information.,vlan,"['A. To manage VLAN configuration and propagate it to other switches', 'B. To assign IP addresses to devices in the VLAN', 'C. To encrypt traffic in a VLAN', 'D. To monitor traffic on a VLAN']"
Which type of VLAN is used to separate management traffic from other types of network traffic?,,D,"A Management VLAN is used to isolate management traffic from user data traffic, enhancing security and network management.",vlan,"['A. Voice VLAN', 'B. Data VLAN', 'C. Native VLAN', 'D. Management VLAN']"
Which of the following is true about VLANs?,,B,VLANs reduce the number of broadcast domains by segmenting the network into smaller logical networks.,vlan,"['A. VLANs increase the number of broadcast domains', 'B. VLANs reduce the number of broadcast domains', 'C. VLANs eliminate the need for routing', 'D. VLANs require special routing hardware']"
What is the maximum number of VLANs that can be created on a Cisco switch that supports IEEE 802.1Q?,,C,"IEEE 802.1Q allows for the creation of up to 4096 VLANs, with VLAN IDs ranging from 1 to 4095.",vlan,"['A. 512', 'B. 1024', 'C. 4096', 'D. 8192']"
What is the primary function of the Data Link layer in the OSI model?,,Data encapsulation and error detection,"The Data Link layer is responsible for framing data, providing error detection, and ensuring reliable data transfer over a physical link.",datalink-layer,"['Data routing', 'Data encapsulation and error detection', 'Data encryption', 'Path selection']"
Which protocol operates at the Data Link layer of the OSI model?,,Ethernet,"Ethernet is a protocol that operates at the Data Link layer, managing access to the physical network and addressing data frames.",datalink-layer,"['IP', 'Ethernet', 'HTTP', 'TCP']"
Which of the following is used to uniquely identify a network interface at the Data Link layer?,,MAC address,The MAC address is a unique identifier assigned to each network interface at the Data Link layer to ensure proper communication on the network.,datalink-layer,"['IP address', 'MAC address', 'Subnet mask', 'Port number']"
What type of address is used in Ethernet frames to identify the sender and receiver?,,MAC address,Ethernet frames use the MAC address to identify both the sender and receiver devices on a local network.,datalink-layer,"['IP address', 'MAC address', 'Port address', 'Domain name']"
What is the maximum length of an Ethernet frame?,,1500 bytes,"The maximum size of an Ethernet frame is 1500 bytes, including both the header and payload, but excluding the CRC trailer.",datalink-layer,"['512 bytes', '1500 bytes', '2048 bytes', '10000 bytes']"
Which of the following is a function of the Media Access Control (MAC) sublayer?,,Addressing,"The MAC sublayer is responsible for addressing, providing unique identifiers (MAC addresses) to network interfaces and managing access to the physical medium.",datalink-layer,"['Error correction', 'Addressing', 'Routing', 'Encryption']"
Which of the following devices operates at the Data Link layer?,,Switch,A switch operates at the Data Link layer and is responsible for forwarding frames based on MAC addresses.,datalink-layer,"['Router', 'Switch', 'Hub', 'Gateway']"
What is the purpose of an Ethernet frame's CRC field?,,Error detection,The CRC (Cyclic Redundancy Check) field is used to detect errors in the frame's data during transmission.,datalink-layer,"['Addressing', 'Error detection', 'Error correction', 'Compression']"
Which protocol is used for error detection at the Data Link layer in Ethernet networks?,,Ethernet CRC,"Ethernet uses the CRC (Cyclic Redundancy Check) for error detection at the Data Link layer, ensuring reliable data transmission.",datalink-layer,"['ARP', 'TCP', 'ICMP', 'Ethernet CRC']"
Which layer of the OSI model does Ethernet operate on?,,Data Link,"Ethernet operates at the Data Link layer of the OSI model, responsible for the transfer of data between devices on the same local network.",datalink-layer,"['Network', 'Data Link', 'Transport', 'Physical']"
What is the function of the Logical Link Control (LLC) sublayer?,,Protocol identification,The LLC sublayer is responsible for identifying the higher-layer protocols and ensuring proper data encapsulation and communication.,datalink-layer,"['Data framing', 'Error detection', 'Protocol identification', 'MAC addressing']"
Which of the following is a standard that defines Ethernet networking at the Data Link layer?,,802.3,The IEEE 802.3 standard defines the operation of Ethernet networking at the Data Link layer.,datalink-layer,"['802.11', '802.1X', '802.3', '802.5']"
What is the primary function of a bridge in a network?,,Filtering frames based on MAC addresses,"A bridge operates at the Data Link layer and filters frames based on MAC addresses, segmenting a network and reducing traffic.",datalink-layer,"['Forwarding IP packets', 'Routing data packets', 'Filtering frames based on MAC addresses', 'Encrypting data streams']"
What is the difference between a hub and a switch at the Data Link layer?,,"A switch uses MAC addresses to forward frames, while a hub broadcasts all data","A hub is a simple device that broadcasts all data to all devices, while a switch forwards data based on the MAC address of the destination device.",datalink-layer,"['A switch forwards frames based on IP addresses, while a hub broadcasts all data', 'A switch uses MAC addresses to forward frames, while a hub broadcasts all data', 'A hub operates at Layer 3, while a switch operates at Layer 2', 'There is no difference']"
Which address is used to send data to all devices in an Ethernet network?,,Broadcast,A broadcast address is used to send data to all devices in an Ethernet network.,datalink-layer,"['Unicast', 'Multicast', 'Broadcast', 'Anycast']"
What type of address does an Ethernet frame use to identify the destination device?,,MAC address,Ethernet frames use MAC addresses to identify the destination device on a local network.,datalink-layer,"['IPv4 address', 'MAC address', 'Port address', 'Domain name']"
"In an Ethernet network, what does a switch use to determine where to forward a frame?",,MAC address,A switch uses the destination MAC address of a frame to determine which port to forward the frame to.,datalink-layer,"['IP address', 'MAC address', 'Port number', 'Subnet mask']"
Which of the following can help improve network performance by reducing collision domains?,,Switch,"A switch can reduce collision domains because it forwards frames based on MAC addresses, unlike a hub, which broadcasts data to all ports.",datalink-layer,"['Hub', 'Switch', 'Router', 'Bridge']"
What is the main purpose of the FCS (Frame Check Sequence) in an Ethernet frame?,,Error detection,The FCS field is used to detect errors in the frame during transmission using the CRC method.,datalink-layer,"['Frame synchronization', 'Error detection', 'Encryption', 'Compression']"
What is the main purpose of VLANs in the Data Link layer?,,Segmentation of traffic based on MAC addresses,VLANs segment traffic based on MAC addresses to create separate broadcast domains within the same physical network.,datalink-layer,"['Segmentation of traffic based on IP addresses', 'Segmentation of traffic based on MAC addresses', 'Network address translation', 'Data encryption']"
Which type of Ethernet frame is used to send data to a single destination device?,,Unicast,A unicast frame is used to send data to a single specific destination device identified by its MAC address.,datalink-layer,"['Broadcast', 'Multicast', 'Unicast', 'Anycast']"
Which protocol is responsible for resolving MAC addresses to IP addresses in a network?,,ARP,ARP (Address Resolution Protocol) is used to resolve an IP address to a MAC address in a local network.,datalink-layer,"['ARP', 'RARP', 'DNS', 'DHCP']"
Which of the following is an example of a Layer 2 device?,,Switch,"A switch is a Layer 2 device, which operates at the Data Link layer and forwards frames based on MAC addresses.",datalink-layer,"['Router', 'Switch', 'Firewall', 'Modem']"
Which of the following is responsible for providing error correction at the Data Link layer?,,PPP,PPP (Point-to-Point Protocol) provides error correction and error detection at the Data Link layer.,datalink-layer,"['TCP', 'ARP', 'Ethernet', 'PPP']"
Which of the following devices can be used to connect different LAN segments while filtering traffic based on MAC addresses?,,Bridge,A bridge is used to filter traffic based on MAC addresses and connect different LAN segments.,datalink-layer,"['Hub', 'Router', 'Switch', 'Bridge']"
Which of the following is the purpose of a MAC address?,,Identify a device across a network,A MAC address is a unique identifier assigned to a network interface card (NIC) to identify a device at the Data Link layer.,datalink-layer,"['Identify a device across a network', 'Define the port number', 'Identify the protocol', 'Define the network segment']"
Which of the following Ethernet standards supports Gigabit Ethernet?,,802.3ab,"The 802.3ab standard supports Gigabit Ethernet, typically operating at speeds of 1000 Mbps.",datalink-layer,"['802.3i', '802.3u', '802.3ab', '802.3z']"
What is the purpose of the Preamble in an Ethernet frame?,,Data synchronization,"The Preamble is used to synchronize the transmission of data, ensuring that the sender and receiver are aligned on the bit rate.",datalink-layer,"['Data synchronization', 'Error detection', 'Data addressing', 'Error correction']"
Which Ethernet frame type is used to send data from one device to all devices on the network?,,Broadcast,"A broadcast Ethernet frame sends data to all devices on the network, using the MAC address FF:FF:FF:FF:FF:FF.",datalink-layer,"['Unicast', 'Multicast', 'Broadcast', 'Anycast']"
What is the purpose of a VLAN?,,To segment a physical network into multiple logical networks,"A VLAN segments a physical network into multiple logical networks, providing separation for traffic and improved security.",datalink-layer,"['To route traffic based on IP addresses', 'To segment a physical network into multiple logical networks', 'To encrypt data', 'To combine multiple networks into a single broadcast domain']"
